{
  "circuit_id": "trade/import-landed-cost@2.0.0",
  "spec_version": "vrl/circuit/1.0",
  "circuit_hash": "a9f2c5e1b7d4f3a8c6e2b9f5d1a7c4e9b2f6a3d8c5e1f9a2b7d4c6e8f1a3b",
  "domain": "trade",
  "name": "import-landed-cost",
  "version": "2.0.0",
  "description": "Calculates the landed cost of imported goods with enhanced support for bonded warehouses and free trade agreements.",
  "long_description": "Version 2.0 extends the import landed cost circuit with support for bonded warehouses and Free Trade Agreement (FTA) eligibility. It verifies not only the base landed cost calculation but also applies dynamic duty reductions for FTA-eligible goods and accounts for warehouse type selection. This is suitable for more complex international trade scenarios involving preferential trade arrangements.",
  "input_schema": {
    "private": [
      {
        "name": "customs_value",
        "type": "integer",
        "description": "The declared customs value of the goods in USD cents"
      },
      {
        "name": "freight",
        "type": "integer",
        "description": "Freight charges in USD cents"
      },
      {
        "name": "insurance",
        "type": "integer",
        "description": "Insurance charges in USD cents"
      },
      {
        "name": "quantity",
        "type": "integer",
        "description": "Quantity of items imported"
      },
      {
        "name": "warehouse_type",
        "type": "integer",
        "description": "Warehouse type: 0=standard, 1=bonded, 2=foreign trade zone"
      }
    ],
    "public": [
      {
        "name": "hs_code",
        "type": "integer",
        "description": "10-digit Harmonized System code"
      },
      {
        "name": "country_of_origin",
        "type": "string",
        "description": "ISO 3166-1 alpha-2 country code"
      },
      {
        "name": "shipping_mode",
        "type": "string",
        "description": "Shipping mode: sea, air, rail, or road"
      },
      {
        "name": "fta_eligible",
        "type": "boolean",
        "description": "Whether goods are eligible for FTA preferential rates"
      }
    ]
  },
  "output_schema": {
    "public": [
      {
        "name": "landed_cost",
        "type": "integer",
        "description": "Total landed cost in USD cents"
      },
      {
        "name": "duty_amount",
        "type": "integer",
        "description": "Customs duty amount in USD cents (with FTA reduction if applicable)"
      },
      {
        "name": "mpf_amount",
        "type": "integer",
        "description": "Merchandise Processing Fee in USD cents"
      },
      {
        "name": "hmf_amount",
        "type": "integer",
        "description": "Harbor Maintenance Fee in USD cents"
      },
      {
        "name": "fta_savings",
        "type": "integer",
        "description": "Duty savings from FTA preference in USD cents"
      }
    ]
  },
  "proof_systems": ["plonk-halo2-pasta"],
  "constraint_count": 12,
  "instance_layout": [
    "landed_cost_commitment",
    "duty_amount_commitment",
    "fta_savings_commitment",
    "public_inputs_hash_commitment"
  ],
  "dataset_dependencies": [
    {
      "dataset_id": "cbp/hts-tariff-rules",
      "min_version": "2026.1.0",
      "description": "US Harmonized Tariff Schedule rates and rules"
    },
    {
      "dataset_id": "ustr/fta-eligibility",
      "min_version": "2026.1.0",
      "description": "USTR Free Trade Agreement eligibility matrix by HS code and country"
    }
  ],
  "certification_tier": "CERTIFIED",
  "certified_by": "Trail of Bits (Third-party audit)",
  "certification_date": "2026-04-01T14:00:00Z",
  "audit_report": "https://github.com/vrl-protocol/audits/tree/main/2026/import-landed-cost-2.0.0",
  "published_at": "2026-04-01T14:00:00Z",
  "updated_at": "2026-04-01T14:00:00Z",
  "author": "VRL Trade Working Group",
  "author_email": "trade@vrl-protocol.org",
  "license": "Apache-2.0",
  "repository": "https://github.com/vrl-protocol/circuits-trade",
  "tags": ["trade", "customs", "tariff", "import", "compliance", "fta", "bonded-warehouse"],
  "security_notes": "Third-party audited. Formally verified FTA eligibility logic. Bonded warehouse accounting has been tested against 50+ real-world scenarios.",
  "performance_notes": "Constraint count: 12 (vs 8 in v1.0). Proof generation time: ~150ms. Proof size: ~2.1KB.",
  "compliance_frameworks": ["CBP_ACE"],
  "changelog": [
    {
      "version": "2.0.0",
      "date": "2026-04-01",
      "changes": "Added FTA eligibility support, bonded warehouse accounting, and formal audit"
    },
    {
      "version": "1.0.0",
      "date": "2026-03-15",
      "changes": "Initial release"
    }
  ],
  "deprecated": false
}
