{
  "circuit_id": "general/tee-inference-attestation@1.0.0",
  "spec_version": "vrl/circuit/1.0",
  "circuit_hash": "d1f8c5a9b2e7d3f6a8c1e4b7d0f5a2c9e3f1b8d5a7c2e6f1a3b8c5d9e2f4a",
  "domain": "general",
  "name": "tee-inference-attestation",
  "version": "1.0.0",
  "description": "Verifies that an AI inference occurred inside a trusted execution environment and binds the computation to TEE attestation.",
  "long_description": "This circuit enables verification of AI inference execution within a Trusted Execution Environment (TEE), such as Intel TDX, AMD SEV-SNP, or AWS Nitro Enclaves. It binds the inference output to hardware attestation quotes, providing cryptographic proof that computation occurred in an isolated, tamper-proof environment. Essential for high-assurance AI applications.",
  "input_schema": {
    "private": [
      {
        "name": "tee_quote",
        "type": "string",
        "description": "Base64-encoded TEE quote from the enclave"
      },
      {
        "name": "tee_report_data",
        "type": "string",
        "description": "Report data included in the TEE quote"
      },
      {
        "name": "enclave_mrenclave",
        "type": "string",
        "description": "Enclave measurement (MRENCLAVE) value"
      }
    ],
    "public": [
      {
        "name": "tee_type",
        "type": "string",
        "description": "Type of TEE: intel-tdx, amd-sev-snp, aws-nitro"
      },
      {
        "name": "model_hash",
        "type": "string",
        "description": "SHA-256 hash of AI model weights"
      },
      {
        "name": "inference_timestamp",
        "type": "integer",
        "description": "Unix timestamp of inference"
      }
    ]
  },
  "output_schema": {
    "public": [
      {
        "name": "tee_verified",
        "type": "boolean",
        "description": "Whether TEE attestation is valid"
      },
      {
        "name": "enclave_identity",
        "type": "string",
        "description": "Verified enclave identity hash"
      },
      {
        "name": "report_timestamp",
        "type": "integer",
        "description": "Timestamp from the TEE report"
      }
    ]
  },
  "proof_systems": ["tee-intel-tdx", "tee-amd-sev-snp"],
  "constraint_count": 4,
  "instance_layout": [
    "tee_verification_commitment",
    "enclave_identity_commitment",
    "public_inputs_hash_commitment"
  ],
  "dataset_dependencies": [],
  "certification_tier": "REVIEWED",
  "certified_by": "VRL Maintainers",
  "certification_date": "2026-03-05T08:00:00Z",
  "published_at": "2026-03-05T08:00:00Z",
  "updated_at": "2026-03-05T08:00:00Z",
  "author": "VRL Core Contributors",
  "author_email": "core@vrl-protocol.org",
  "license": "Apache-2.0",
  "repository": "https://github.com/vrl-protocol/circuits-general",
  "tags": ["tee", "attestation", "confidential-computing", "hardware", "enclave"],
  "security_notes": "Verifies hardware attestation quotes. Quote verification depends on availability of Intel/AMD/AWS attestation verification services. Suitable for confidential AI inference.",
  "performance_notes": "Constraint count: 4. Proof generation time: ~50ms (attestation verification dominates timing). Proof size: ~1.5KB.",
  "changelog": [
    {
      "version": "1.0.0",
      "date": "2026-03-05",
      "changes": "Initial release supporting Intel TDX and AMD SEV-SNP"
    }
  ],
  "deprecated": false
}
