{
  "circuit_id": "trade/export-compliance-check@1.0.0",
  "spec_version": "vrl/circuit/1.0",
  "circuit_hash": "f3d8a1c7e4b9f2d5a8c1e6f3b7d4a9c2e5f8b1a6d3c8e1f4a7b2c5d8e1f4a",
  "domain": "trade",
  "name": "export-compliance-check",
  "version": "1.0.0",
  "description": "Verifies export eligibility based on destination country restrictions, product classification, and sanctions lists.",
  "long_description": "This circuit performs export compliance verification by checking product classifications against CCL (Commerce Control List) items, verifying destination country restrictions, and checking against OFAC sanctions lists. It produces a cryptographic proof that an export decision was made according to applicable regulations.",
  "input_schema": {
    "private": [
      {
        "name": "hs_code",
        "type": "integer",
        "description": "10-digit Harmonized System code for the product"
      },
      {
        "name": "item_description",
        "type": "string",
        "description": "Detailed text description of the item being exported"
      },
      {
        "name": "quantity",
        "type": "integer",
        "description": "Quantity of items being exported"
      },
      {
        "name": "unit_value",
        "type": "integer",
        "description": "Unit value in USD cents"
      }
    ],
    "public": [
      {
        "name": "destination_country",
        "type": "string",
        "description": "ISO 3166-1 alpha-2 country code of destination"
      },
      {
        "name": "exporter_id",
        "type": "string",
        "description": "Exporter company identifier or EIN"
      },
      {
        "name": "end_use",
        "type": "string",
        "description": "Intended end use: commercial, government, military, or scientific"
      }
    ]
  },
  "output_schema": {
    "public": [
      {
        "name": "compliant",
        "type": "boolean",
        "description": "Whether the export is compliant with regulations"
      },
      {
        "name": "restriction_codes",
        "type": "array",
        "description": "Array of applicable export restriction codes (e.g., EAR, ITAR, OFAC)"
      },
      {
        "name": "license_required",
        "type": "boolean",
        "description": "Whether an export license is required"
      },
      {
        "name": "review_required",
        "type": "boolean",
        "description": "Whether human review is recommended"
      }
    ]
  },
  "proof_systems": ["plonk-halo2-pasta"],
  "constraint_count": 6,
  "instance_layout": [
    "compliance_status_commitment",
    "license_requirement_commitment",
    "public_inputs_hash_commitment"
  ],
  "dataset_dependencies": [
    {
      "dataset_id": "bae/ccl-items",
      "min_version": "2026.2.0",
      "description": "Bureau of Industry and Security Commerce Control List"
    },
    {
      "dataset_id": "treasury/ofac-sdn",
      "min_version": "2026.1.15",
      "description": "Office of Foreign Assets Control Specially Designated Nationals list"
    }
  ],
  "certification_tier": "REVIEWED",
  "certified_by": "VRL Maintainers",
  "certification_date": "2026-03-20T09:45:00Z",
  "published_at": "2026-03-20T09:45:00Z",
  "updated_at": "2026-03-20T09:45:00Z",
  "author": "VRL Trade Working Group",
  "author_email": "trade@vrl-protocol.org",
  "license": "Apache-2.0",
  "repository": "https://github.com/vrl-protocol/circuits-trade",
  "tags": ["trade", "export", "compliance", "sanctions", "eccn"],
  "compliance_frameworks": ["EAR", "ITAR", "OFAC"],
  "security_notes": "Does not make final export authorization decisions. Circuits must be validated against current CCL and OFAC lists before use. Dataset dependencies are critical.",
  "performance_notes": "Constraint count: 6. Proof generation time: ~80ms. Proof size: ~2KB.",
  "changelog": [
    {
      "version": "1.0.0",
      "date": "2026-03-20",
      "changes": "Initial release with CCL and OFAC list checking"
    }
  ],
  "deprecated": false
}
